{
  "$schema": "https://json-schema.org/draft/2020-12/schema",
  "$id": "https://auri.local/contracts/event.schema.json",
  "title": "AURI Event Envelope",
  "type": "object",
  "additionalProperties": false,
  "required": ["schema_version", "event_id", "session_id", "type", "source", "timestamp", "payload"],
  "properties": {
    "schema_version": {"const": "0.2.0"},
    "event_id": {"type": "string", "minLength": 1},
    "session_id": {"type": "string", "minLength": 1},
    "type": {
      "type": "string",
      "enum": [
        "task.created",
        "meeting.overrun",
        "scene.approaching",
        "scene.vehicle_entered",
        "scene.parked",
        "traffic.updated",
        "wearable.signal",
        "driving.signal",
        "vehicle.control",
        "user.utterance",
        "service.mock.config",
        "confirmation.confirmed",
        "cooldown.elapsed",
        "session.reset"
      ]
    },
    "source": {
      "type": "string",
      "enum": ["mobile", "vehicle_hmi", "wearable", "demo_console", "agent_api"]
    },
    "timestamp": {"type": "string", "format": "date-time"},
    "correlation_id": {"type": ["string", "null"]},
    "device_id": {"type": ["string", "null"]},
    "payload": {"type": "object", "additionalProperties": true}
  },
  "allOf": [
    {
      "if": {"properties": {"type": {"const": "vehicle.control"}}},
      "then": {
        "properties": {
          "source": {"const": "vehicle_hmi"},
          "payload": {
            "type": "object",
            "minProperties": 1,
            "additionalProperties": false,
            "properties": {
              "ac_on": {"type": "boolean"},
              "ac_target_temp": {"type": "number", "minimum": 16, "maximum": 30},
              "ac_mode": {"enum": ["auto", "cool", "heat", "fan"]},
              "fan_speed": {"enum": ["low", "medium", "high"]}
            }
          }
        }
      }
    }
  ]
}
