{
  "schema_version": "0.2.0",
  "event_id": "evt_confirm_vehicle_001",
  "session_id": "demo_run_001",
  "type": "confirmation.confirmed",
  "source": "vehicle_hmi",
  "timestamp": "2026-07-15T18:28:05+08:00",
  "correlation_id": "demo_run_001",
  "device_id": "vehicle_display_01",
  "payload": {
    "confirmation_id": "confirm_all_001",
    "decision": "accept",
    "input_mode": "button"
  }
}
